modality,query,answer,pdf,page
text,"What percentage of the GDP did total current healthcare expenditure in the UK account for in 2018, and how does this compare to 2017?","10.0% of gross domestic product (GDP) in  2018, compared with 9.8% in 2017",1690009,1
text,"During the 1974 business meeting of the Organization of Student Representatives within the Association of American Medical Colleges, what specific conditions were outlined in the approval of the proposed policy for the release of AAMC information?","any  information  including the  names  of  individual  medical  students  be  in  the ""restricted""  category,  and  that  this  information  he released  only  with  the  approval  of  that  individual and/or  the  OSR  Administrative  Board",1697417,8
text,"How is full-time equivalent defined for state employees, and how is it calculated for students in K-12 and higher education?","one person working full-time for one year.  This  equates to working approximately 2,088 hours of paid staff time.  Two persons working half- time count as one FTE.  For K-12 and higher education students, FTE can refer to the  equivalent of one student attending class full-time for one school year based on fixed hours of  attendance.",1704905,12
text,What period does the current budget cover for the 2019-21 biennium in Washington State's budget cycle?,"July 1, 2019 through June 30, 2021",1704905,7
text,What is the duration of Washington State's biennium budget cycle?,two-year,1704905,7
text,Under which specific provision of the American Rescue Plan Act of 2021 is funding allocated to the Treasury and for what purpose?,Emergency Rental Assistance â€¢ $21.55 billion to Treasury for Emergency Rental Assistance,1706518,4
text,How many overnight trips does Microsoft propose will be replaced by online meetings by year 3 of investing into the solutions of Microsoft 365?,350,1706862,3
text,What was the purpose of Microsoft's TEI framework?,"to identify the cost, benefit, flexibility, and  risk factors that affect the investment decision",1706862,7
text,"What percentage of Americans, older than 12, listened to the radio each week in 2017?",92%,1716961,7
text,Where was the General Data Protection Regulation originally established?,Europe,1716961,14
text,What recent data from the United States indicates both a rise in savings and an increase in spending at the same time?,"Inflation data has showed personal  incomes jumping 21.1% in March, the biggest  monthly increase on record.",1718379,0
text,"How much is the combined market cap of Apple, Microsoft, Amazon, and Google?",$7.5 trillion,1718379,0
text,"What were progressive credit union's total membership, shares, deposits, loans, surplus, assets, and income reported at the end of the 2019?","Total membership at the end of the year stood at 7,430 members. â€¢	 Total shares stood at $84,312,767 â€¢	 Increase in Deposits from $7,342,248 to $7,843,290 â€¢	 Decrease in loans from $91,624,989 to $86,032,073 â€¢	 Increase in Surplus from $4,405,798 to $4,892,484 â€¢	 Total Assets reduced from $118,617,664 to $112,715,162 â€¢	 Total Income decreased from $12.9 million to $12.3 million",1728679,11
text,What is the projected end-of-year credit loss for Progressive Credit Union?,"$7,163,770",1728679,28
text,What nowadays are the two largest sectors of the economy in the UK?,financial  services and the creative industries,1738963,8
text,What is the importance of nurturing creativity through education,"Since  creative skills will be so central to employment,  it is essential that these are developed across  society or the current social and economic  inequities will grow.",1738963,9
text,What is T.V.E.T. stands for?,technical and vocational education and training,1738963,4
text,"What does the term ""Ordinary Time"" in the Catholic Church's liturgical year refer to?",parts of the calendar of  the Catholic Church that are unimportant,1742062,1
text,What are the four major seasons of Catholic Church's liturgical year?,"Advent,  Christmas,  Lent,  and Easter",1742062,1
text,"Why is Ordinary Time called ""ordinary"" in the liturgical calendar of the Catholic Church?","not because it is  common, but simply because the weeks of Ordinary  Time are numbered. The Latin word  ordinalis , which  refers to numbers in a series",1742062,1
text,What is the purpose anti-bark collars?,deliver  an unpleasant stimulus when your dog barks,1747044,1
text,why do dogs bark?,it is a form of normal  communication,1747044,0
text,What does attention-seeking barking signify in dogs?,he would like something,1747044,0
text,"What factors contribute to the negative impact on the population of the Wheeling Area, where deaths consistently outnumber births","larger-than-normal  share of elderly residents, but causes of death from a host  of issues ranging from heart disease to drug overdoses  among younger cohorts living in the region",1764106,6
text,What did the job market in the Wheeling Area between late 2009 and mid-2016 look like?,"After gaining 2,600 jobs between late-2009 and early- 2014, the Wheeling Area went on to lose nearly an  equivalent amount of jobs from that point until mid- 2016.",1764106,1
text,Where can I locate information on the tariffs of all the Australasian colonies and the United Kingdom?,Victorian Year-Book   asian  colonics  1881-2,1784314,0
text,How many years has the current mode of classification been used in Victoria?,The year under review is the seventh,1784314,0
text,How frequently has the Alberta Recreation Survey been conducted since 1981?,every four years,1784333,3
text,What are the popular leisure activities for adults in Alberta?,"walking (80%),  gardening (55%), bicycling (46%), fitness/aerobics (44%), and jogging/running (32%)",1784333,8
text,Where can I reliably find additional information about COVID-19?,Center for Disease Control and Prevention,1789126,6
text,"What are the main concerns people have about the COVID-19 epidemic, and what are some of the forecasts regarding the peak of the virus and the restart of the economy?","if we are implementing the right policies, when the virus will peak, and when we can restart the  economy. Many forecasts, including the model from the Institute for Health Metrics and Evaluation (IHME), predict a peak in April",1789126,0
text,"What is the total number of confirmed Covid-19 cases in Haiti as of July 14, 2020?","6,902",1796331,10
text,What measures are taken to evaluate visitors arriving in Antigua & Barbuda on commercial flights for COVID-19?,"staying at approved accommodation are  evaluated for COVID-19 with a series of health screenings, temperature checks and nose swabs taken for  the coronavirus test",1796331,2
text,What services does small business services offer for jobseekers in New York City?,"financing assistance, business courses, legal advising,  help navigating government, recruitment and training",1808221,5
text,"According to the U.S. Department of Veterans Affairs, how many is the approximate population of veterans within the five boroughs of New York City?","235,000",1808221,7
text,Which two countries are the most important partners in security policy?,United  Kingdom and the United States,1809452,17
text,What is the overall geopolitical challenge of EU?,to find the right balance between economic efficiency  and security interests,1809452,13
text, What are some concepts that have emerged due to the deteriorating international scene?," â€œEuropean sovereigntyâ€, â€œstrategic autonomyâ€, â€œdigital sovereigntyâ€, â€œtechnological  sovereigntyâ€ and â€œopen strategic autonomyâ€",1809452,1
text,Who developed the surface Twizzle Torus?,Nicholas Schmitt,1821101,0
text,What is the Twizzle Torus?,an annular  surface with a constant  mean curvature in the three- dimensional sphere,1821101,0
text,What are the projected AirPods unit sales for the year 2023?,99.7  million,1821485,1
text,"According to Artillery Intelligence, what is the estimated size of the ""hearables"" market currently?",$10.9 million,1821485,1
text,What is Artillery Data Briefs?,research deliverables that are assembled weekly by ARtillery Intelligence  analysts to document the market trends and events theyâ€™re tracking,1821485,5
text,In what year did the Chinese Exclusion Act prevent Chinese immigrants from entering the U.S.?,1882,1836293,9
text,What is the significance of the english language to immigrants?,it connects immigrants to public life and increases overall life satisfaction,1836293,20
text,What are some of the challenges involved in 3D mapping?,obtain well- refined model using only cheap monocular camera without  additional equipment like depth sensors or active transmitter,1846515,0
text,What are some examples of sensors typically used for 3D reconstruction processes?,RGB-D (red-green-blue and depth) which is used in  Microsoft Kinect [2]. It is applied for extraction the depth from  both static and dynamic scenes in indoor [3] and outdoor  environments [4]. Another example of depth sensor is  Occipitalâ€™s structure sensor intended for mobile devices [5].  Another type of devices specially designed for capturing  depth  information  are  time-of-flight  (ToF)  cameras.,1846515,0
text,"Based on the United Nations research, what has been the trend in the death rate since 2014?",inching up about 1% to 1.5% every  year,2017568,1
text,What university utilized CDC data?,John Hopkins University,2017568,3
text,What percentage of women in Britain say they have experienced sexual harassment?,68%,2017830,3
text,What percentage of American adults are worried about mass shootings? ,45%,2017830,3
text,Who is the co-editor of Gilani's Gallopedia weekly digest?,Asra Malik,2017830,0
text,What are the reasons behind the decline in productivity and prosperity in Arizona since the mid-2000s?,reduction in educational attainment in Arizona relative to the nation,2033711,18
text,What was Arizona's national ranking for broadband access?,36 th,2033711,18
text, What significant achievements were made by Fred Sanger and Janet Rossant?,Fred Sanger invents a method for rapid DNA  sequencing and publishes the first full DNA  genome of a living being  Janet Rossant creates a chimera combining two  mice species,2037338,3
text,How long does it typically take from incorporation to achieve the first major drug sales in the pharmaceutical industry?,8-12 years,2037338,29
text,What year was Humulin approved? ,1983,2037338,4
text,What was the year-to-year increase in unemployment in the City of Las Cruces compared to the United States?,3.3%,2046361,0
text,What two primary factors are driving changes in the unemployment rate in Las Cruces?,the number of employed  individuals changes or the number of those that are active in the labor market changes,2046361,5
text,"What was the motivation behind creating the HunterSurvey, ShooterSurvey, and AnglerSurvey?","help outdoor  businesses and the conservation community better understand trends regarding hunting, fishing  and outdoor-related spending and activities",2050937,4
text,What equipment is frequently purchased by freshwater and saltwater anglers?,Lures and terminal tackle,2050937,11
text,"According to the National Survey, which activity do sportswomen predominantly participate in? ",fishing,2050937,3
text,"What are the reported efficacy and safety rates for Pfizer, Moderna, J&J, and AstraZeneca covid vaccines?",70â€95%Â andÂ veryÂ reasonableÂ safety,2052352,1
text,What covid vaccine company announced a 95% efficacy rate and safety on November 18?,Pfizer,2052352,2
text,"As of 2020, were there any chemoprophylactic drugs approved for preventing SARS-CoV-2 infection?",No,2052352,142
text,What are the primary qualities that influence consumer acceptance of a product?,"packaging, and then on its smell, appearance, and texture (touch and feel)",2065810,1
text,which types of products were utilized in the study on personal-care products formulated with natural antioxidant extracts?,"hand cream, body oil, shampoo, clay mask, body exfoliating cream, and skin cleanser",2065810,0
text,What are six of the most important groups of cosmetic products?,"hand cream, body oil, shampoo, clay mask, body exfoliating cream, and skin cleanser",2065810,0
text,"When did Congress sign the Coronavirus Aid, Relief, and Economic Security (CARES) Act?","March 27, 2020",2068497,3
text,What is the decay rate of the Las Vegas metropolitan statistical area compared to the state average?,9.5 percent compared to the Stateâ€™s decay rate of 6.8  percent,2068497,8
text,"Between February 2007 and April 2007, what was the peak employment level reached in the Carson City MSA?","33,300",2068497,0
text,What was the main focus of Ferdinand KÃ¤hler's work?,"bio-  and CO 2 -based chemicals and materials with a  focus on strategies, technology, markets, policy and  sustainability",2070070,1
text,Which industry primarily uses virgin fossil carbon as the foundational material for its products?,chemical industry,2070070,21
text,What percentage of global warming effects is attributed to emissions of carbon-containing greenhouse gases?,92Â %,2070070,7
text,"What were the demographics of the participants in the study titled ""Age and Vigilance: The Effects of Event Rate and Task Pacing""?",Thirty-six  male  and  twelve  female  volunteers   ages  18  to  76,2085852,3
text,How was Trans World Airlines found guilty of age discrimination?,by   not  allowing  pilots  to  become  flight  engineers  and  forcing   them  to  retire  at  age  60,2085852,13
text,How did john D Watson die?,heart  at-Â·  tack,2086619,36
text,Where was James P. Watson born?,England,2086619,0
text,When was the new line of the Oregon Railroad and Navigation Company extended to McKay?,"August 20, 1881",2086619,10
text,What happened to Finland when Noah Lake was formed?,Finland was deserted,2088597,7
text,What year did Iohn Catto find Troy?,2002,2088597,0
text,What historical civilizations are described in the Commune of PerniÃ¶ in southwest Finland?,"Norse,  Finnisb and Greek",2088597,0
text,How high did Ireland's transport sector's emissions increase in 2015?,4%,2089825,4
text,"Under the Climate Action and Low Carbon Development Act, who is obliged to submit an action plan on how Ireland will cut climate pollution?",Denis Naughten TD,2089825,0
text,How many organizations make up Stop Climate Chaos? ,30,2089825,5
text,What is the maximum length of Sai Yok bent-Â­toed gecko in inches?,2.4Â inches,2098077,1
text,What characteristic sets the Sai Yok Bent-toed gecko apart from other species in the Cyrtodactylus genus?,enlargedÂ thighÂ scales,2098077,1
text,What is the name of the new gecko species that was discovered in western Thailand?,SaiÂ YokÂ bentÂ­toedÂ geckoÂ ( CyrtodactylusÂ saiyok ),2098077,0
infographic,What is the best type of environment to help manage trauma from depression?,"A calm, safe, empowering environment for both the staff and patients.",1021748,24
infographic,What systemic changes can improve the overall health of a black person in the United States?,Granting members of the black community equal access to quality health care like everyone else.,1028096,29
infographic,"Without protective eyewear, what's the percentage chance of infection or transmission of COVID-19?",16.00%,1000360,3
infographic,"Besides trained and research staff, who can provide intervention to help adults dealing with overuse problems with stimulants?",Peers of those adults,1025332,5
infographic,Who can offer advice on the appointment of the Director of DOEE and DCPSC to the mayor?,The DC City Council,1019364,17
infographic,Whats the most effective way to change people in regards to mitigation of and adaptation to climate change?,By teaching and making people aware of climate change,1059801,71
infographic,Can strong evidence contain credible dissent?,No.,1002697,17
infographic,What is average bedroom Latinos can afford to rent with the average Latino yearly income in Rhode Island?,None because the average 1 bedroom yearly is higher than the average Latino income in Rhode Island.,1031214,3
infographic,How can Kafue Flats manage to maintain its fish population?,By reducing the harvest of juvenile bream.,1027721,16
infographic,What is the appropriate distance to be around people in public spaces while wearing a mask to prevent the spread of COVID-19?,Always try to keep at least 6 feet away from people,1017488,27
infographic,When did Ontario Biodiversity Council decide to develop and implement biodiversity plans at the muncipal levels?,From 2016-2020,1011129,11
infographic,What type of pain does Cortisol help deal with?,Headache pain,1016869,8
infographic,What is the best type of control when it comes to COVID-19 and why?,Elimination is the best type of control because preventing the individuals with the virus from entering the area removes the possibility the area can spread the virus completely.,1043275,6
infographic,"According to the c&k careers, what category does waiting staff and Kitchen assistant/porter fall under?",Hospitality,2150019,54
infographic,What are the three components when it comes to balance?,"Breaks: regularly recharge at work, boundaries: leave work at work, and basics: routine, eat well, hydrate, exercise, and sleep. ",1385576,37
infographic,What company is the largest water and water recycling company in England?,anglianwater,2065236,1
infographic,What actions do Beissbarth recommend for tires?,"Replace tires, check tire pressure, and check wheel alignment. ",1420915,6
infographic,What other aspect should be considered when evaluating a student beyond their academic performance?,Holistic advising,1156980,177
infographic,What is the utilising common set units in modelling and outputs?,"MW, MWh",2230864,19
infographic,What considered a Service used in Mobility Services Aggregator or MaaS Provider?,Car Clubs/ Fleets/ Car,2248035,5
infographic,"When individuals wear face masks or respirators, what are the chances of infection or transmission?",3.10%,1000360,3
infographic,What year did the expanded compliance school occur?,2019,2317507,103
infographic,What are the waste product from the cow that serves as a fertilizer?,Dung and urine,2262231,1
infographic,"In governance, AHPRA enters a formal agreement with council on behalf of board with details of ?",services and funding,2412070,5
infographic,"What do SIGINT, GEOINT, and WX stand for?","SIGINT - signals intelligence 

GEOINT - geospatial intelligence 

WX - weather ",1326089,62
infographic,What do you call to an object used to protect the sea turtle from danger of predation and has to be installed 2 metres apart in the hatchery?,nests,2257670,8
infographic,What are one of the challenges of terraforming Mars?,"increase the atmospheric pressure, which is currently less than 1% that of Earth.",1227955,6
infographic,"According to zone 1, how far is the required feet to keep the tree branches away from the chimney and other trees?",10,2179890,1
infographic,What feature of autonomous machine that helps to radar incoming cars that cannot be seen visually by the side mirror?,Blind spot detection,2251524,0
infographic,"In Block diagram of DSSC power module, the storage device is stored of what ion capacitor?",Lithium,2409286,2
infographic,How many jobs are supported by PIP in the Portsmouth city council area?,"2,410",2231857,2
infographic,What are the main topics when it comes to the ecuador whatsapp information line?,"Blood donation, psychological support, covid-19, migration, and risk reduction.",1374189,97
infographic,At what age can you join the DuPage Children's Museum's Spring Break Camp?,7-10,1033210,16
infographic,What happens when an RNA vaccine is injected into a patient?,It enters cells and tells them to produce coronavirus spike protein,1144040,111
infographic,"Since March 2020, what percentage of respondents reported that they were unable to receive arthritis specific healthcare services? ",32%,2193296,0
infographic,What makes up the strong evidence rule?,Evidence and Dissent,1002697,17
infographic,"If out in the wilderness, what surface can you use to safely fillet a fish with a knife?",A log,1243369,14
infographic,"According to Anticoagulation Centers of Excellence for treatment of Cancer-Associate Venous Thrombeombolism (VTE) , what is the duration months to study Hokusai VTE Cancer4 in landmark trial characteristics?",12 months,2141199,25
infographic,What do you call to a continuum of collaboration where there is limited student portability?,Pre-redesign PASSHE,2029694,206
infographic,How many school pupils grown up in Medway has social emotional and mental health needs in the year 2018?,1482,2279695,10
infographic,"If an individual is addicted to marijuana, what are the chances of them being addicted to heroin?",3x more likely to be addicted to heroin,1064553,0
infographic,What is the electrical safety device that should be installed and test once a month?,Ground Fault Circuit Interrupters,2403632,23
infographic,Who created the five step plan?,Douglas G. Pratt,2308830,1
infographic,What kind of gas is the 2/3rds of aviation's total climate impact according to transport & environment?,non-co2,2029469,17
infographic,What is the disease that result from correction of metabolic acidosis?,Hypokalemia,2132659,238
infographic,How did we help caregivers provide better care to their patients?,We trained 252 caregivers in being able to use music with their routine.,2198517,8
infographic,"In verse john 11:1-45, Jesus raised Lazarus from what?",the dead,2275559,24
infographic,"In the program outline for three months, the above the line is called the 'Doing Agile' and the below the line is called?",Being Agile',2321888,81
infographic,"In Humidity-Control Bags cycle, what do you call the substance that returned to refresh saline brine concentration for next bag reuse?",SALT,2241995,27
infographic,What percentage of gamers do in-game chat with people they're friends with?,67%,1073663,23
infographic,"In Economic Stabilization, What is the highest percentage that Small Business Relief Loan/ Grant owned?",50%,2331520,78
infographic,What are the benefits of researching and developing a solution with a modular design platform?,To allow for fast tweaks and customization,1132343,47
infographic,What virus is chemically inactivated with a chemical called beta-propiolactone?,SARS-CoV2,1832877,62
infographic,What comes after insufficient support from directly affected residents?,Review complete councillor may request a report.,1330815,163
infographic,"In Mental Health Services and Support, what is the name of the service hotline for counseling men?",Mensline,2179881,11
infographic,"In 4 Tiers of Caregiver Celebration, what do you called an award where quarterly institute-level managers nominate top performing individuals and team?",Excellence Awards,2187784,29
infographic,What does the End-user zone consist of?,"Mail Server, SIEM, and Blue team & threat hunter",1314022,19
infographic,"In scope for policy alignment in government, what is under the national?",National Development Plan (NDP) 2030),2234793,15
infographic,"In the Oracle Real Application Cluster, what database is the ASM Shared storage stored at including the Datafiles, Log Files and Control Files?",PROD Database,2158222,109
infographic,How effective are Chevron signs in reducing nighttime accidents?,Chevron signs reduce nighttime crashes by 25%,2020425,629
infographic,"According to the Safe System Approach, who are the vulnerable to death or severe injury as vehicular speed increases?",Pedestrians and bicyclists,2309243,9
infographic,Who created the social distancing in public parks and trails guidelines for COVID-19?,National Recreation and Park Association,2077790,3
infographic,"What do you call the disease model that includes the isogenic cell lines, knock cell lines, and cell lines?",vitro,2037338,108
infographic,What is the last process in waterfall phase that helps to diagnose any issues or problem before the software is released?,Testing,2238249,14
infographic,What are the two ouputs of message passing graph neural network?,Graph embeddings and dynamic graph embedding.,1286228,50
infographic,"In Housing and urban areas, what is used to concentrate growth away from critical areas?",UGAs,2317530,86
infographic,"In terms of SARS-CoV-2, what is the next step after Thrombin generation?",Fibrinogen to fibrin,1257474,14
infographic,What do COâ‚‚ and sugar participate in within chloroplasts?,The Calvin Cycle.,1347269,2
infographic,How are physical and mental health connected?,Physical and mental health are connected because eating well and exercising help release endorphins,1093596,0
infographic,What are the key purposes of the Dubbo Project deposit?,"Defence, renewable energy, aerospace, electric vehicles, and electronics. ",1334928,7
infographic,What should SCHOOLMONTANA be supporting?,"SCHOOLMONTANA must support all modern versions of JUNOS, which isa version of FreeBSD customized by Juniper. ",1284408,8
infographic,"What climate of development attitude and behaviors includes the children in making decisions, correcting the children's own mistakes, and acknowledging the children's ideas?",Kids Share Control,2034985,4
infographic,What is the eighth step in sanitizing your hands from any microbe or virus?,Air dry,2195644,3
infographic,"According to the IFCA, What is the mininum size that a plaice in cm can be to keep?",27,2227308,1
infographic,Who is the recreation coordinator under the Parks and Recreation Hierarchy Chart?,Travis Anderson,2202524,82
infographic,"Over how many days did patients who completed self-assessments, received the study product, and underwent a blood draw at the end of the study period participate?",14 days.,1275957,7
infographic,What are some components when it comes to exosome based cancer?,"Exosomes-SIRPa variant, exosomes-TRAIL, and cell apoptosis. ",1392116,4
