modality,query,answer,pdf,page
table,How much did Pendleton County spend out of their COVID-19 fund for the month of April 2021?,$205.43 ,1003421,2
table,How many units are occupied by single families of Klamath county in 2009?,5,1008059,6
table,"In the Klamath county, what is the total valuation of construction for census code 434 in 2009?","768,235 USD",1008059,6
table,How much did Nalco pay GRIDCO for electricity at captive power plant in the year 2010-11?,Rs. 6519.61 lakhs,1011810,21
table,How much coal is used at Alumina refinery of Nalco in the year 2011-12?,"1,105,716 tonnes",1011810,21
table,What is the interest cost on gratuity at Nalco in the fiscal year 2012?,19.6,1011810,74
table,"In fiscal year 2012, how much were the salaries and wages at Nalco?",Rs. 891.86 crores,1011810,74
table,"How much Earmarked funds does Mishra Badhai & Associates have for PATANG on March 31, 2014?","Rs. 3,541,436.00",1022784,19
table,What is the beginning balance of the Pinal County Treasurer's account in December 2017?,"259,231.43",1048308,61
table,"While calculating the total income of Sutlej Textiles and Industries Limited for year 2019, what sources are included?","1) Revenue from operations, 2) Other income",1050851,1
table,"In the city of Humble, how many incident reports did the fire department receive on October 10, 2017?",7,1054125,17
table,In Geotech Engineering and Testing what is the unit rate for vehicle charge ?,$7.50 ,1057021,47
table,"What was the total capital assets balance of the Town of Johnstown, Colorado at the end of FY16?","$11,422,841 ",1057315,104
table,"How much is the value of Depreciation in the drainage fund in Johnston, CO?","5,752",1057315,90
table,How much did Brick Board of Education spent in total on central services for the fiscal year 2017?,"$1,052,920.03 ",1061589,39
table,What was the total expenditure of Brick Board of Education on custodial services for fiscal year 2017?,"$5,483,706.31 ",1061589,39
table,What was the estimated population in Seattle in the year 2012?,"616,500",1061646,58
table,How many hours will be invested in the plans & specifications of the 2021 Pavement Rehabilitation Project in the city of Benicia?,18,1067588,61
table,What is the total estimated cost for the 2021 Pavement Rehabilitation Project in the city of Benicia?,"$163,965 ",1067588,61
table,What was the local tax rate of the town of Newton in 2016? ,1.427,1068798,3
table,what was the municipal tax rate in the town of Newton in 2015?,1.3948,1068798,3
table,"In Jackson County, what are the total expenditures of housing authority for the year 2013-14?","$131,970 ",1071056,73
table,"How much fund was disbursed by the city of Southaven on ""Travel and Training"" in the first quarter of the year 2015?","4,572.19 USD",1073013,115
table,On what street is the Hamilton Hotel located in the Central District?,Telegraph Avenue,1077956,90
table,How many hotels are located in the central district?,31,1077956,90
table,"According to the 2020 WO-WAS fund report, how much was spent on traveling by the board members in the month of February?",96.47 Dollars.,1084420,14
table,What is the discount computer magazine price of computer games for 2 years?,$20.95 ,1092414,14
table,"For fiscal year 2014-2015, what all liabilities are included to calculate the total balance of other noncurrent liabilities of the city of Rochester, New York?","NYS Canal Corp. Lease, Workers' Compensation, Pollution Remediation, OPEB Liability, NYS Pension Liability Amortization",1094619,62
table,"What was the total general obligation bonds balance of the city of Rochester in New York in the beginning of the fiscal year, on July 1, 2014?","$112,686 ",1094619,62
table,What was the real GDP growth rate of Canada when its Federal government debt was between 30 to 60 percent during 1925-2009? ,4.5,1096078,19
table,"How much amount in total was carried forward to 2020 in the form of 'Revenue', by NATO Strategic Communication Center of Excellence?","109,485 USD",1096626,22
table,What is the chemical formula for Hydrazine?,H4N2,1099125,165
table,What is the total unaudited asset value of Albany County Airport Authority in 2021?,"338,136,406 USD",1102242,19
table,Which criteria decides the final net position value for Albany County Airport Authority?,"1. Invested in Capital Assets, net of Related Debt. 2. Restricted Assets 3. Unrestricted assets.",1102242,19
table,What are the total revenues of Orcutt Union School District for year 2014-15?,"27,348,429",1102324,44
table,How much did Orcutt Union School District spend in total for year 2013-14?,"24,844,254",1102324,44
table,How many actual halts occurred before trade for rolled out NYSE Arca in September 2013?,112,1106908,14
table,"In September 2013, what was the total Opening BAM for rolled out NYSE Arca?",167,1106908,14
table,How much did the Wiener Library receive in donations and legacies from end of FY14 to FY15? ,"120,990 Euro",1107310,14
table,"In FY15, what is the total income and endowments of the Wiener Library?","1,265,768 Euros",1107310,14
table,What was the usage rate of budget for water increment in FY15 for the Municipal Water District of Orange County?,78.07%,1110594,32
table,"In 1938, when does the first passenger train of Flatonia Subdivision leave Yoakum?",4:30 PM,1111073,6
table,What is the due amount of utilities in Irvine Child Care Project for October 2018?,"$7,262.75 ",1111667,35
table,How many new cases were filed for non-parking traffic misdemeanors at the City of Humble Municipal Court in May 2018?,"1,474",1113772,32
table,What is the projected monthly surplus of the Florida Department of Elder Affairs for program LSP for 2021? ,"($42,046)",1121142,0
table,"What were the total operating expenses of the Fortune Society, Inc. in FY19?","$34,706,430 ",1121870,139
table,"In FY18, how much did the Fortune Society Inc. and Affiliates spend in total for fundraising?","$1,170,464 ",1121870,139
table,How much did Headway East Lothian SCIO spend in total for charitable activities in year 2020?,"42,678.18",1126272,17
table,"In the village of Williamsville, what is the adjusted budget for grant writer in 2011?","6,500.00",1127866,12
table,"In Australia, which area observed a highest population growth rate in the year 1971 to 1981?",Australian Capital Territory,1131257,7
table,What is the average population growth rate in Australia across years 1961 to 1991?,1.70%,1131257,7
table,"What was the actual expense for engineering of the water and sewer fund of Jacksonville, NC in 2005? ","$193,278 ",1149133,166
table,"What is the total expenditure for governmental activities in the city of Jacksonville, North Carolina for the fiscal year 2006?","$30,525,484 ",1149133,254
table,What was World Vision of Ireland's total income earned from sponsorship and childcare in September 2017?,"2,188,904",1154736,48
table,Where is the registered office of Richfield Financial Services LTD? ,"33 Brabourne Road, 5th Floor, Kolkata-700 001",1155228,2
table,What was the reported current assets of Timaru Christian School in 2019? ,"87,178",1161467,5
table,"At Tomagh station, which shrub was most consumed by goats during the bloom season of 1989?",Ebenus stellatus,1162412,148
table,"In 1989, what was the overall rate of consumption of grass by goats at Tomagh station?",53.09,1162412,148
table,Who is the author of Computer Oriented Numerical Methods? ,R.S. Salaria,1164798,1
table,How many pages are in Professional Ethics and Human Values by Premvir Kapoor?,196,1164798,1
table,"How much is the net cash outflow from investing activities at the year end March 31, 2020 of Sangam Rooftop Solar Private Limited?","1,79,53,800",1175147,34
table,What was the total cost of liabilities for the Area Agency of Pasco-Pinellas Inc. for December 2020?,"$2,859,897 ",1181127,0
table,What was the total equity of Metro Alliance Holdings and Equities Corp. and Subsidiaries in 2013?,"99,969,806",1184258,143
table,What is the total revenue for transportation services in the Rural Municipality of Stanley for 2019?,"$394,200 ",1187393,21
table,"What is the total revenue for environmental health services for the year end Dec. 31, 2019, in the rural municipality of Stanley?","$131,217 ",1187393,21
table,What was the total value of PBC Limited's assets in December 2020?,"905,919",1196312,6
table,What is the total amount spent by Brick Board of Education on construction services in the year 2016?,"4,679,034.18 USD",1196756,53
table,"After the overall expenditures, what was the final available balance for Brick Board of Education in FY16?","946,248.62 USD",1196756,53
table,What was the total cash the Apache Fire District allocated to payroll in 2014?,"$633,883.97 ",1198299,39
table,How much is the ending balance for cash reconciliation as of 4/30/2014 for the Apache Fire Distrcit??,"3,153,030.34",1198299,39
table,"How much is 122 Corbett Road property of Gulf Islands, Salt Spring in 2017?","$395,000 ",1209807,158
table,What are the total expenses in Q1 2020 of Hero MotorCorp?,"5,840.73",1210932,12
table,What is the exact amount spent by the IFLS Library towards Dell Marketing L.P in October 2020?,6495.49 Dollars,1213932,9
table,How much did McPherson Center Museum spend on repairing and replacements in the year 2012 till June 30?,"105,169",1224598,26
table,What is the operating expense of the Museum of Art and History at McPherson Center in 2012?,"309,312",1224598,26
table,What is the clearance rate of criminal cases in 2019 In the Superior Court?,85%,1224605,30
table,How many case filings occurred involving mental health in the Superior Court for 2018?,"38,874",1224605,30
table,What is included in the revenues while calculating the total revenues of Orcutt Union Elementary of Santa Barbara County for year 2016-2017?,"LCFF Sources, Federal Revenues, Other State Revenue, Other Local Revenue",1238564,78
table,What was the total expenditure budget of Orcutt Union Elementary in Santa Barbara County for year 2017-2018?,15000,1238564,78
table,What was the budget for grounds and general maintenance for the Yeovil Town Council in 2017-2018? ,"222,520 Euro",1238975,1
table,What is Yeovil Town Council's total committees' budget for 2015-2016?,"848,447",1238975,1
table,What is the total audited income of Piccadily Agro Industries Ltd. at the end of the year 2021?,"49,284.75 lacs Rs.",1240123,16
table,"In FY19, what were the earnings per share of the Saudi Research and Marketing Group?",3.08,1243103,12
table,What was the gross profit of Saudi Research and Marketing Group in FY20?,"774,677,826",1243103,12
table,"During 2008-2009, what was the percentage difference between adults reported as overweight in the city of Manchester and the whole state?",0.20%,1246906,62
table,"According to NH DHHS, what is the percentage of adults smoking between 2008 and 2009 in the city of Manchester?",20.6,1246906,62
table,What is the year end proforma balance in FY19 for total long-term debt of Abenaki Water Company?,"$938,386 ",1260223,1
table,How much adjustment did Abenaki Water Company do on total equity capital for FY19?,"$6,631 ",1260223,1
table,"What is the maximum amount disbursed in June 2018, from the municipal water district of Orange County?",326.92 USD,1271006,36
table,What is the total annual budget of community development department in the city of Sebastian for year 2020/2021?,"514,512.00",1280950,57
table,Which general fund department of the city of Sebastian received the highest annual budget for the year 2020/2021?,Parks/Recreation department,1280950,57
table,"In the 1950s, were people who were schizophrenics more likely to be employed or unemployed? ",Unemployed,1305807,5
table," In the town of Bristol, what is the actual % of budget on FICA in 2019?",24.47%,1306987,16
table,"In the year 2019, how much is the user fees on the issued budget of the town of Bristol?","55,460.00",1306987,16
table,"With a percentage, how much of the Town of Bristol's Listing Department's budget was used in 2019? ",21.93%,1306987,6
table,What was the Town of Ocean Breeze's current millage rate for 2022,3.08,1308437,7
table,What is the collection allowance for the millage rate in the town of ocean breeze in 2022?,5%,1308437,7
table,Was the total reserves spent on the City of Cockburn in the 2019 to 2020 year within budget?,"No, actual 5,254,526 over budget",1321440,617
table,"What is the closing balance of the City of Cockburn as of April 30, 2020?","21,122,370",1321440,617
table,What is the total audited income of Betex India Limited when the fiscal year ended on March 2020?,Rs. 5689.10 lakhs,1330778,1
table,"In the fiscal year 2019-2020, how much did the materials consumed by Betex India Limited cost?",Rs. 2211.03 lakhs,1330778,1
table,"what is Valley View Independent School District's primary source of revenue as of August 31, 2014?",State program Revenues,1334323,69
table,"What is the total expenditure recorded till August 31, 2014 for the Valley View Independent School District ?","6,294,230 USD",1334323,69
table,What was the total value of Credit Bank of Moscow's assets September 2018?,"1,948,853",1342176,6
table,"When the fiscal year ended in March 2020, how much profit did Nirlon Limited gain from operating activities before income tax cut?","Rs. 14,649.08 lakhs",1370808,7
table,What is the total estimated population in the continent of Australia at the end of the year 1881?,"2,206,802",1385012,93
table,Which colony of United Kingdom had the highest estimated population in the year 1871?,British India,1385012,93
table,"In the town of Canton, what was the original budget given for employee program in the fiscal year 2014?","$10,000 ",1394114,29
table,How much was the accounting expense from Dec 20 - Feb 21 of the NorCal H&I Committee?,685,1395993,41
table,What was the Martin County Population in 2019?,"161,000",1396830,15
table,What is the net investment in capital assets of Harris County Appraisal District for 2013?,"$9,021,196 ",1397880,60
table,What were the legal expenses of the Town of Bath in 1995?,"1,230",1402494,15
table,What is the cost of materials utilized in the first quarter of 2021 at Vippy Spinpro Limited?,"2,192.94",1404153,5
table,What was the total expenses amount for Vippy Spinpro Limited in 2020?,2402.97,1404153,5
table,"In Bristol, how many hazardous incidents were reported for January 2021?",47,1407201,22
table,"In 2011, how much population is estimated to be in Darrington Town?","1,345",1407894,61
table,What was the estimated population of Bothell Area in 2011?,"39,760",1407894,62
table,How much is the employment growth rate in Everett City across years 2011-2035?,31.40%,1407894,66
table,What is the total amount spent on judges for FWD Fall Convention/Contests for fall 2008,"5,950 USD",1408320,90
table," In 2019, what is the total income of Youth Sport Trust from charitable activities?","9,840,638 Euros",1409378,22
table,"What is the total of noncurrent assets of Hatsun Agro Product Limited as at March 31, 2021?","239,906.08",1417811,4
table,How many percent of manufactured fertilizer products of APEC economics exported by Japan in the year 1992?,0.93,1417915,14
table,What is the H.S code for ammonium sulphate?,3102.21.00,1417915,16
table,What is the average dispatch time for structure fire in C3 in the city of Humble?,0:00:18,1449377,43
table,What is the total call time for accident major in MED 1 in the city of Humble?,17:38:16,1449377,43
table,What was the total revenue of Durant Industrial Authority Fund 020 in January 2021? ,"11,835.98",1452020,5
table,What is the total In-Kind budget for year 1 of the TRCA agreement?,"$1,256,455 ",1452082,80
table,What items are included in the Winmore Leasing and Holding Limited's Shareholders' fund?,"Share capital, Reserves and Surplus",1456765,33
table,How much is the aggregate value of Winmore Leasing and Holding Limited's immovable properties in 2018?,"2,23,36,790",1456765,40
table,How much is the total equity of the Shire of Serpentine Jarrahdale for the year 2016?,"$275,958,647 ",1462854,5
table,When is the city tour of Dubai  during the International Youth to Youth Summit for 2017? ,"Tuesday, April 25th, 2017 at 17:00-19:30",1465272,13
table,Which location in Moses Lake county had the highest traffic counts in the year 2013?,"150' S/O Broadway, Alder Street",1476497,46
table,What is Bank of America Corporation and Subsidiaries' consumer banking total deposits in the second quarter of 2021?,"987,655",1487957,32
table,What is the average price given by Prime Residences for the luxury apartments in Jawatte project?,"50,800,000",1504717,23
table,How many units does the Prime Residences offer in total in Barnes Place location?,15,1504717,23
table,How much was the total expenses of the Anjani Finance Limited in the year end 31/03/2021?,83.41,1505923,2
table,How much was the profit/(loss) before tax in the end of quarter 30/06/2021 of the Anjani Finance Limited?,15.95,1505923,2
table,"In Van Buren, what was the proposed budget for total expenditure of solid waste/ sanitation operations in year 2021 to 2022?","335,400",1555645,41
table,"In Van Buren, what was the proposed budget for total expenditure of courthouse & jail maintenance operations in year 2021 to 2022?","74,205",1555645,58
table,Which college got the first rank in the 2006 cross country Southeastern Classic?,Virginia Intermont College,1559000,1
table,How many schools participated in the 2006 Southeastern Classic cross country race?,25,1559000,1
table,How much was the final budget of fire department in the year 2018/19 for the City of of Ponca City?,"5,592,441",1565378,97
table,What is the number code of Finance Department of City of Ponca City?,1110,1565378,97
table,"What is the projected payroll of KMS Actuaries for all departments as of January, 2019?","27,381,485",1569418,2
table,What are the total assets of Town of Ashland in 2014?,"$9,840,914 ",1569715,105
table,What is the total audited income of Budge Budge Company Limited at the end of the year 2018?,"Rs. 20,343.74 lakhs",1570322,2
table,Which ISO/IEC 27001 Controls do not fully satisfy the intent of the NIST SP 800-53 Controls?,"{""text"":[""Access Control Decisions - A.9.4.1*"",""Role-Based Training - A.7.2.2*"",""Content of Audit Records - A.12.4.1*""]}",1587443,17
table,"For 2021, how much budget was requested for general fund revenue in total in the city of Morgantown?","$39,716,045 ",1602122,18
table,"In the city of Morgantown, what was the total amended budget for fiscal year 2020 for all personnel services in city hall?","371,314",1602122,28
table,Does the mean death rate of Australia exceed that of the mean death rate in Australasia (Australia with Tasmania and New Zealand) in the year 1873??,"yes, 0.23",1618689,45
table,Are the mean marriage rates in New Zealand mostly increasing or decreasing between the years 1865 and 1881?,mostly decreasing,1618689,4
table,How much amount did the Wantage Town Council receive from fairs in the FY20?,"2,300",1627614,3
table,What is the total expenditure of Wantage Town Council for year 2020/2021?,"370,528",1627614,3
table,What was the actual expense in 2009-2010 for equipment for the Department of Parks & Grounds in the City of Melissa? ,$428 ,1629440,110
table,What was the proposed budget for total debt service expenditure in the city of Melissa for year 2010-2011?,"1,174,026.27",1629440,117
table,What was the total expenses for the year ended 31 March 2020 for sutle j textiles?,"2,345.70",1631010,1
table,What is Sutlej Textiles and Industries' revenue from operations for the first quarter of 2020?,528.92,1631010,1
table,How much external debt did Surinam have in the year 1968?,6.3 millions Surinam guilders,1652446,59
table,"How much interest income did PBM Polytex Limited receive from investing activities at the end of the fiscal year, on March 2019?",Rs. 37.02,1652701,15
table,"How much was the net cash flow from investing activities of PBM Polytex Limited at the year end March, 2019?","2,362.97 lakhs",1652701,7
table,"How much was the profit before taxation of PBM Polytex Limited at the year end March, 2020?",159.29 lakhs,1652701,7
table,What is the minimum hourly compensation for an assistant engineer in the city of La Mesa?,33.85,1667648,57
table,"In 2021, what was the minimum pay for an Administrative aide in La Mesa County?",$23.10/hour,1667648,64
table,How much was the revenue from operations of Gland Pharma Limited at the quarter end 30-Jun-21?,"11,539.00",1679161,1
table,"In Livingston County, what is the total valuation of commercial property in the Iosco township?","717,600 USD",1690070,77
table,"What is the total valuation of residential properties in Howell, Brighton, and Fenton in Livingston County?","503,011,415 USD",1690070,77
table,"What is the total estimated costs for Macedo Contracting Services, Inc. across all active contracts in FY19?","$6,631,775 ",1696634,254
table,Which specialty doctors had the most density in 1965?,General and Family Medicine,1697417,70
table,What is the total of income of Neelamalai Agro Industries Limited in the quarter end 31/12/2020?,759.62,1721391,1
table,What was the cost of Neelamalai Agro Industries Limited's materials in the year 2021?,485.53,1721391,1
table, In the year 2018 how much was the Progressive Credit Union's bank advance?,"1,355,243",1728679,62
table,What is the value of total cash and cash equivalents for Progressive Credit Union in 2019?,"947,943",1728679,62
table,How much were the depreciation and amortization expenses of Mangalam Organics Limited at the end of the quarter on June 2018?,Rs. 137.30 lakhs,1731763,2
table,"What is the total un-audited income of Mangalam Organics Limited at the end of the quarter, on June 30, 2017?","Rs. 3,852.62 Lakhs",1731763,2
table,Who owns the Michigan property located at 619 W. End in the city of Alma?,Tracy Mikel,1740459,1
table,What are the financial liabilities of JSC TBC Leasing in FY2017?,"Loans from banks and financial institutions, Debt securities in issue, Advances received from customers, Subordinated loan, Other financial liabilities",1748512,36
table,What is the total amount of total financial assets of JSC TBC Leasing for the year 2017?,"183,138,127 Georgian Lari",1748512,36
table,"How much compensation did Doug Lansdale receive in the Carroll County Fiscal Court on June 25, 2021?",600,1748940,1
table,What is the total comprehensive audited income of BanyanTree Bank Limited at the end of the year 2016?,"Rs. 42,515,550",1764787,2
table,What is included in the Policy Incentives program of Victorville disposal in the city of Adelanto?,"Product and Landfill Bans, Economic Incentives, Ordinances, Other Policy Incentives",1771748,21
table,What was the budget given for Union/Palmer Park Improvements by Pikes Peak Rural Transportation Authority in 2017?,"150,817",1773240,10
table,What was the average cost of construction per mile for Lancefield railway line that opened in 1882?,"4,198 Euros",1784314,70
table,How much did it cost in total to construct the Castlemaine and Dunolly line that opened in 1882?,"289,879 Euros",1784314,70
table,Who is the instructor for Swim Strokes class in the Decatur County Family YMCA?,Carrie,1825530,9
table,How much was Transport & Investment Barter Company's total capital value in 2019?,"13,915,000",1846598,31
table,What is the country of birth of John A Lindstrom?,Sweden,1853294,30
table,What is the total amount spent by the Philodrill Corporation on Paid-up capital ?,"1,743,479,943.52",2010544,7
table,"In 2008, what was the total income of Trans-Asia Oil and Energy Development Corporation before the income tax was cut?","â‚±229,171,176",2023897,186
table,"In May 2018, how much was the 'County Open Space Taxes Payable' for  the township of Middletown?   ","402,959.11 USD",2028148,36
table,How much was the opening balance in 2012 for the Samuha Indian Money Contribution?,404080.03,2029194,11
table,"In FY 2004, what is the cost per credit hour in the Mohave district?",$38 ,2033711,17
table,"In Nevada, which city has the highest unemployment rate?",North Las Vegas,2068497,14
table,"What is the value of total resources when it comes to non-expandable income of the town of Amherst, Massachusetts?",2083.79,2071953,145
table,"How much is the interest for Cemetery Perpetual Care in expendable fund of the town of Amherst, Massachusetts?","2,264.63",2071953,145
table,"In 2020-2021, which accounts have more than 100% expenditure for the Tamalpais Community Service District ?",Miscellaneous & Vehicle parts.,2086192,15
table,Who is the chamber president of Chesterfield Regional Chamber?,Matt Kasten,2102641,17
table,How many chamber members are there in RiverBend Growth Association?,400,2102641,17
table,What is the DO District's annual budget for Prof-engineering in fy2018?,"224,500 USD",2113852,6
table,What was the final salary of refuse clerk in the fiscal year 2012 for the town of Amherst?,"$37,370.00 ",2132040,299
table,What is the estimated budget for salaries of years 2016-2017 for the city of Los Banos in wastewater administration?,"204,702",2136247,91
table,"In 2013 in Prince Edward Island , what are the realized/unrealized gains from Canadian short term investment?",423,2157001,36
table,"In Prince Edward Island, what is the total investment income of Teachers' superannuation fund investments in 2012?","{""text"":[""1. Equity Investment & Real estate 2. Foreign Infrastructure"",""$15,914,843""]}",2157001,36
table,"In 2016, what is the total of incoming resources in North Wales Central?","295,949 Euros",2159007,17
table,"In Amenia, what fund received the highest adopted budget in 2008?",General Funds,2165625,44
table,What was the adopted budget for buildings for the town of Amenia in 2008?,"125,338",2165625,47
table,"In Maricopa County, what is the revenue estimated for detention operations in the year 2020?","203,707,919",2182429,267
table,"In the fiscal year 2020 of Maricopa County, how much revenue is estimated for expedited child support?","637,500",2182429,267
